{
  "schema_version": "v1",
  "format": 1,
  "textures": [
    {
      "path": "textures/base.png",
      "width": 4,
      "height": 4,
      "format": "png",
      "premultiplied_alpha": false
    }
  ],
  "slots": [
    {
      "slot_id": "acc_belt",
      "texture_path": "textures/base.png",
      "uv": [
        0.296875,
        0.46875,
        0.703125,
        0.5
      ]
    },
    {
      "slot_id": "accessory_back",
      "texture_path": "textures/base.png",
      "uv": [
        0.125,
        0.02734375,
        0.875,
        0.5
      ]
    },
    {
      "slot_id": "accessory_front",
      "texture_path": "textures/base.png",
      "uv": [
        0.125,
        0.02734375,
        0.875,
        0.5
      ]
    },
    {
      "slot_id": "ahoge",
      "texture_path": "textures/base.png",
      "uv": [
        0.421875,
        0.0078125,
        0.578125,
        0.06640625
      ]
    },
    {
      "slot_id": "arm_l_a",
      "texture_path": "textures/base.png",
      "uv": [
        0.71875,
        0.3515625,
        0.9375,
        0.5
      ]
    },
    {
      "slot_id": "arm_l_b",
      "texture_path": "textures/base.png",
      "uv": [
        0.71875,
        0.1875,
        0.9375,
        0.3359375
      ]
    },
    {
      "slot_id": "arm_r_a",
      "texture_path": "textures/base.png",
      "uv": [
        0.0625,
        0.3515625,
        0.28125,
        0.5
      ]
    },
    {
      "slot_id": "arm_r_b",
      "texture_path": "textures/base.png",
      "uv": [
        0.0625,
        0.1875,
        0.28125,
        0.3359375
      ]
    },
    {
      "slot_id": "brow_l",
      "texture_path": "textures/base.png",
      "uv": [
        0.5078125,
        0.1484375,
        0.6171875,
        0.16796875
      ]
    },
    {
      "slot_id": "brow_r",
      "texture_path": "textures/base.png",
      "uv": [
        0.3828125,
        0.1484375,
        0.4921875,
        0.16796875
      ]
    },
    {
      "slot_id": "cheek_blush",
      "texture_path": "textures/base.png",
      "uv": [
        0.3515625,
        0.1953125,
        0.6640625,
        0.2421875
      ]
    },
    {
      "slot_id": "cloth_cape",
      "texture_path": "textures/base.png",
      "uv": [
        0.1875,
        0.109375,
        0.8125,
        0.890625
      ]
    },
    {
      "slot_id": "cloth_main",
      "texture_path": "textures/base.png",
      "uv": [
        0.125,
        0.328125,
        0.875,
        0.5
      ]
    },
    {
      "slot_id": "cloth_skirt",
      "texture_path": "textures/base.png",
      "uv": [
        0.25,
        0.4609375,
        0.75,
        0.6875
      ]
    },
    {
      "slot_id": "eye_iris_l",
      "texture_path": "textures/base.png",
      "uv": [
        0.51953125,
        0.171875,
        0.61328125,
        0.2109375
      ]
    },
    {
      "slot_id": "eye_iris_r",
      "texture_path": "textures/base.png",
      "uv": [
        0.38671875,
        0.171875,
        0.48046875,
        0.2109375
      ]
    },
    {
      "slot_id": "eye_lash_lower_l",
      "texture_path": "textures/base.png",
      "uv": [
        0.5078125,
        0.203125,
        0.625,
        0.22265625
      ]
    },
    {
      "slot_id": "eye_lash_lower_r",
      "texture_path": "textures/base.png",
      "uv": [
        0.375,
        0.203125,
        0.4921875,
        0.22265625
      ]
    },
    {
      "slot_id": "eye_lash_upper_l",
      "texture_path": "textures/base.png",
      "uv": [
        0.5078125,
        0.1640625,
        0.625,
        0.19140625
      ]
    },
    {
      "slot_id": "eye_lash_upper_r",
      "texture_path": "textures/base.png",
      "uv": [
        0.375,
        0.1640625,
        0.4921875,
        0.19140625
      ]
    },
    {
      "slot_id": "eye_white_l",
      "texture_path": "textures/base.png",
      "uv": [
        0.5078125,
        0.17578125,
        0.625,
        0.21484375
      ]
    },
    {
      "slot_id": "eye_white_r",
      "texture_path": "textures/base.png",
      "uv": [
        0.375,
        0.17578125,
        0.4921875,
        0.21484375
      ]
    },
    {
      "slot_id": "face_base",
      "texture_path": "textures/base.png",
      "uv": [
        0.28125,
        0.078125,
        0.71875,
        0.328125
      ]
    },
    {
      "slot_id": "face_shadow",
      "texture_path": "textures/base.png",
      "uv": [
        0.2734375,
        0.07421875,
        0.7265625,
        0.33203125
      ]
    },
    {
      "slot_id": "foot_l",
      "texture_path": "textures/base.png",
      "uv": [
        0.328125,
        0.890625,
        0.515625,
        0.96875
      ]
    },
    {
      "slot_id": "foot_r",
      "texture_path": "textures/base.png",
      "uv": [
        0.484375,
        0.890625,
        0.671875,
        0.96875
      ]
    },
    {
      "slot_id": "hair_back",
      "texture_path": "textures/base.png",
      "uv": [
        0.1875,
        0.02734375,
        0.8125,
        0.42578125
      ]
    },
    {
      "slot_id": "hair_front",
      "texture_path": "textures/base.png",
      "uv": [
        0.1875,
        0.029296875,
        0.8125,
        0.21484375
      ]
    },
    {
      "slot_id": "hair_side_l",
      "texture_path": "textures/base.png",
      "uv": [
        0.65625,
        0.078125,
        0.84375,
        0.3125
      ]
    },
    {
      "slot_id": "hair_side_r",
      "texture_path": "textures/base.png",
      "uv": [
        0.15625,
        0.078125,
        0.34375,
        0.3125
      ]
    },
    {
      "slot_id": "hip",
      "texture_path": "textures/base.png",
      "uv": [
        0.3125,
        0.46875,
        0.6875,
        0.5625
      ]
    },
    {
      "slot_id": "leg_l",
      "texture_path": "textures/base.png",
      "uv": [
        0.34375,
        0.546875,
        0.5,
        0.890625
      ]
    },
    {
      "slot_id": "leg_r",
      "texture_path": "textures/base.png",
      "uv": [
        0.5,
        0.546875,
        0.65625,
        0.890625
      ]
    },
    {
      "slot_id": "mouth_base",
      "texture_path": "textures/base.png",
      "uv": [
        0.4375,
        0.23828125,
        0.5625,
        0.28515625
      ]
    },
    {
      "slot_id": "mouth_inner",
      "texture_path": "textures/base.png",
      "uv": [
        0.453125,
        0.244140625,
        0.546875,
        0.279296875
      ]
    },
    {
      "slot_id": "neck",
      "texture_path": "textures/base.png",
      "uv": [
        0.421875,
        0.3046875,
        0.578125,
        0.3671875
      ]
    },
    {
      "slot_id": "nose",
      "texture_path": "textures/base.png",
      "uv": [
        0.4609375,
        0.203125,
        0.5390625,
        0.24609375
      ]
    },
    {
      "slot_id": "torso",
      "texture_path": "textures/base.png",
      "uv": [
        0.25,
        0.3515625,
        0.75,
        0.5
      ]
    }
  ]
}
